,Unnamed: 0,review_title,review,rate,category,rating,Polarity,Analysis,summarization
140,140,Best in the market!,Good product. Made up of good metal. Have a nice grip. Colour is black. Have a good quality . Have a nice structure. This is phone's charging stand. Weight about 300 grams.  This helps to use your phone with more convenience. Must buy.READ MORE,5Best in the market!,portronics-por-122-modesk-universal-mobile-holder-black,5,0.5166666666666666,Positive, Good product. Made up of good metal. Have a nice grip. Colour is black. Have a good quality . Have a nice structure. This is phone's charging stand. Weight about 300 grams. This helps to use your phone with more convenience. Must buy.READ MORE
141,141,Classy product,Good quality product by this companyThe build and the feal is bestIt is one of the best or best mobile phone stand on flipkart Nice.....exelent buid......highly usefull and durableREAD MORE,5Classy product,portronics-por-122-modesk-universal-mobile-holder-black,5,0.8,Positive, Good quality product by this companyThe build and the feal is bestIt is one of the best or best mobile phone stand on flipkart Nice.....exelent buid......highly usefull and durableREAD MORE
142,142,Decent product,"Product quality is good but it should be give angle for adjustable for any situation.This is best only for desk or table uses when you are sitting on chair which height is higher than table or desk then you can easily work with this.For other situations it's just ok.Hardly use to plug in charging cable,there is small space for this.you have to use your phone in landscape mode when you are charging your phone. Otherwise your Data cable can be damage. you can see in the pictures.For Example...READ MORE",3Decent product,portronics-por-122-modesk-universal-mobile-holder-black,3,0.31354166666666666,Positive," Product quality is good but it should be give angle for adjustable for any situation.This is best only for desk or table uses when you are sitting on chair which height is higher than table or desk then you can easily work with this.For other situations it's just ok.Hardly use to plug in charging cable,there is small space for this.you have to use your phone in landscape mode when you are charging your phone."
143,143,Mind-blowing purchase,"I won't say it's a bad product, but except battery no other good features. Sound is very low and bass no more at all. Build quality is good but the design of earbuds is very hectic, it hurts more to ears. The battery is only the good thing with full charge you can use upto 2 days or nearly 3.I gave 5 star not for product but for the service by Flipkart. I didn't liked the product so i returned it and just few minutes after the delivery guy took return the amount is refunded very quickly. Tha...READ MORE",5Mind-blowing purchase,portronics-por-122-modesk-universal-mobile-holder-black,5,0.219212962962963,Positive," I won't say it's a bad product, but except battery no other good features. Build quality is good but the design of earbuds is very hectic, it hurts more to ears. The battery is only the good thing with full charge you can use upto 2 days or nearly 3.I gave 5 star not for product but for the service by Flipkart. I didn't liked the product so i returned it and just few minutes after the delivery guy took return the amount is refunded very quickly."
144,144,Terrific purchase,Perfect product. At a good price. Sturdy build quality. Padded for keeping mobile comfortably. Perfect for your mobile phone. Very useful product.READ MORE,5Terrific purchase,portronics-por-122-modesk-universal-mobile-holder-black,5,0.7180000000000001,Positive, Perfect product. At a good price. Sturdy build quality. Padded for keeping mobile comfortably. Perfect for your mobile phone. Very useful product.READ MORE
145,145,Must buy!,Nice productsREAD MORE,5Must buy!,portronics-por-122-modesk-universal-mobile-holder-black,5,0.55,Positive, Nice productsREAD MORE
146,146,Classy product,Too strong full paisa wasulREAD MORE,5Classy product,portronics-por-122-modesk-universal-mobile-holder-black,5,0.42777777777777776,Positive, Too strong full paisa wasulREAD MORE
147,147,Just wow!,Must buy for studyREAD MORE,5Just wow!,portronics-por-122-modesk-universal-mobile-holder-black,5,0.5,Positive, Must buy for studyREAD MORE
148,148,Excellent,NiceREAD MORE,5Excellent,portronics-por-122-modesk-universal-mobile-holder-black,5,0.5,Positive, NiceREAD MORE
149,149,Just wow!,Good quality and made in India product.READ MORE,5Just wow!,portronics-por-122-modesk-universal-mobile-holder-black,5,0.6,Positive, Good quality and made in India product.READ MORE
150,150,Pretty good,Comfort for every gadgets.READ MORE,4Pretty good,portronics-por-122-modesk-universal-mobile-holder-black,4,0.5,Positive, Comfort for every gadgets.READ MORE
151,151,Really Nice,V nice product 👍READ MORE,4Really Nice,portronics-por-122-modesk-universal-mobile-holder-black,4,0.55,Positive, V nice product 👍READ MORE
152,152,Wonderful,Very nice product with metal body I loved it. 👍🏻👍🏻👍🏻👍🏻👍🏻👍🏻READ MORE,5Wonderful,portronics-por-122-modesk-universal-mobile-holder-black,5,0.66,Positive, Very nice product with metal body I loved it.
153,153,Mind-blowing purchase,This Is also for tablets And nice quality 🥰🥰🥰🥰 Thanks Flipkart 🥰🥰🥰🥰🥰READ MORE,5Mind-blowing purchase,portronics-por-122-modesk-universal-mobile-holder-black,5,0.43333333333333335,Positive, This Is also for tablets And nice quality 🥰🥰🥰🥰 Thanks Flipkart 🥰🥰🥰🥰🥰READ MORE
154,154,Simply awesome,Excellent product 😌READ MORE,5Simply awesome,portronics-por-122-modesk-universal-mobile-holder-black,5,0.75,Positive, Excellent product 😌READ MORE
155,155,Wonderful,It's worth for the price.Good quality.READ MORE,4Wonderful,portronics-por-122-modesk-universal-mobile-holder-black,4,0.4,Positive, It's worth for the price.Good quality.READ MORE
156,156,Classy product,Superb quality... I like it.. u can see images alsoREAD MORE,5Classy product,portronics-por-122-modesk-universal-mobile-holder-black,5,0.75,Positive, Superb quality... I like it.. u can see images alsoREAD MORE
157,157,Perfect product!,Great !! Got @128 Including Offers.. Easy to Hold any mobile even during Charging.. It can also hold 10 Inch tablet easily  No issues..Quality and Material is great...READ MORE,5Perfect product!,portronics-por-122-modesk-universal-mobile-holder-black,5,0.3633333333333334,Positive, Got @128 Including Offers.. Easy to Hold any mobile even during Charging.. It can also hold 10 Inch tablet easily  No issues..Quality and Material is great...READ MORE
158,158,Very Good,Good OneREAD MORE,4Very Good,portronics-por-122-modesk-universal-mobile-holder-black,4,0.6,Positive, Good OneREAD MORE
159,159,Delightful,This is good I liked it thanks ☺️☺️ flipkart ...READ MORE,4Delightful,portronics-por-122-modesk-universal-mobile-holder-black,4,0.49999999999999994,Positive, This is good I liked it thanks ☺️☺️ flipkart ...READ MORE
160,160,Brilliant,This product is good.👍READ MORE,5Brilliant,portronics-por-122-modesk-universal-mobile-holder-black,5,0.5,Positive, This product is good.👍READ MORE
161,161,Wonderful,Good oneREAD MORE,5Wonderful,portronics-por-122-modesk-universal-mobile-holder-black,5,0.6,Positive, Good oneREAD MORE
162,162,Best in the market!,Good quality product Value for moneyREAD MORE,5Best in the market!,portronics-por-122-modesk-universal-mobile-holder-black,5,0.6,Positive, Good quality product Value for moneyREAD MORE
163,163,Just wow!,Fabulous productREAD MORE,5Just wow!,portronics-por-122-modesk-universal-mobile-holder-black,5,0.45,Positive, Fabulous productREAD MORE
164,164,Nice product,"Product is good as I use Iphone 7 and One plus 6t,No issue with product.But courier was delayed and they were not fulfilled the dates they mentioned of deliver.3 times postponed the dates,apart from that Product is fine.READ MORE",4Nice product,portronics-por-122-modesk-universal-mobile-holder-black,4,0.6,Positive," Product is good as I use Iphone 7 and One plus 6t,No issue with product.But courier was delayed and they were not fulfilled the dates they mentioned of deliver.3 times postponed the dates,apart from that Product is fine.READ MORE"
165,165,Nice product,Worth of moneyREAD MORE,4Nice product,portronics-por-122-modesk-universal-mobile-holder-black,4,0.4,Positive, Worth of moneyREAD MORE
166,166,Great product,Good productREAD MORE,5Great product,portronics-por-122-modesk-universal-mobile-holder-black,5,0.6,Positive, Good productREAD MORE
167,167,Classy product,Very Good Product@this Prise.READ MORE,5Classy product,portronics-por-122-modesk-universal-mobile-holder-black,5,0.705,Positive, Very Good Product@this Prise.READ MORE
168,168,Best in the market!,Very niceREAD MORE,5Best in the market!,portronics-por-122-modesk-universal-mobile-holder-black,5,0.35,Positive, Very niceREAD MORE
169,169,Pretty good,That's very good product and it's quility are osm. I Like this product.READ MORE,4Pretty good,portronics-por-122-modesk-universal-mobile-holder-black,4,0.705,Positive, That's very good product and it's quility are osm. I Like this product.READ MORE
170,170,Highly recommended,"This is just a wonderful product, for online classes, zoom meetings and everything you would probably want to do on mobile. Though it doesn't have different viewing angles, but the original one is perfect I feel! Undoubtedly you can go for it!READ MORE",5Highly recommended,portronics-por-122-modesk-universal-mobile-holder-black,5,0.575,Positive," This is just a wonderful product, for online classes, zoom meetings and everything you would probably want to do on mobile. Though it doesn't have different viewing angles, but the original one is perfect I feel!"
171,171,Hated it!,Had expected a better quality item from portronics. Sadly the item is ill-aligned. The phone sits tilted. The holder falls along with the phone when placed vertical towards the  back. Horizontal placement of phone looks tilted on one side. The speaker gets muffled when the phone is placed vertical... sad sad ... cheap manufacturer.  Poor quality item. Not recommended at all... even if they give it out free.. belongs to the trash canREAD MORE,1Hated it!,portronics-por-122-modesk-universal-mobile-holder-black,1,-0.020000000000000007,Negative, Had expected a better quality item from portronics. Sadly the item is ill-aligned. The phone sits tilted. The holder falls along with the phone when placed vertical towards the  back. Horizontal placement of phone looks tilted on one side. The speaker gets muffled when the phone is placed vertical... sad sad ... cheap manufacturer. Poor quality item. Not recommended at all... even if they give it out free.. belongs to the trash canREAD MORE
172,172,Worth every penny,It fits on my tablet it's really amazing.. worth itREAD MORE,5Worth every penny,portronics-por-122-modesk-universal-mobile-holder-black,5,0.46666666666666673,Positive, It fits on my tablet it's really amazing.. worth itREAD MORE
173,173,Worth every penny,Nice product. Value for moneyREAD MORE,5Worth every penny,portronics-por-122-modesk-universal-mobile-holder-black,5,0.55,Positive, Nice product. Value for moneyREAD MORE
174,174,Just wow!,Nice product 😊👍READ MORE,5Just wow!,portronics-por-122-modesk-universal-mobile-holder-black,5,0.55,Positive, Nice product 😊👍READ MORE
175,175,Best in the market!,It is very good for tab also👌👌READ MORE,5Best in the market!,portronics-por-122-modesk-universal-mobile-holder-black,5,0.705,Positive, It is very good for tab also👌👌READ MORE
176,176,Good choice,Product is good but price is higher than the item. But delivery awesomeREAD MORE,4Good choice,portronics-por-122-modesk-universal-mobile-holder-black,4,0.48333333333333334,Positive, Product is good but price is higher than the item.
177,177,Waste of money!,So light in weight. Shakes each time when u operate phone placed in holderREAD MORE,1Waste of money!,portronics-por-122-modesk-universal-mobile-holder-black,1,0.45,Positive, Shakes each time when u operate phone placed in holderREAD MORE
178,178,Great product,Very useful productREAD MORE,5Great product,portronics-por-122-modesk-universal-mobile-holder-black,5,0.445,Positive, Very useful productREAD MORE
179,179,Just wow!,"Very useful but  overpriced, should be of Rs 150 to 200READ MORE",5Just wow!,portronics-por-122-modesk-universal-mobile-holder-black,5,0.445,Positive," Very useful but  overpriced, should be of Rs 150 to 200READ MORE"
180,180,Must buy!,Superrrb qualityREAD MORE,5Must buy!,portronics-por-122-modesk-universal-mobile-holder-black,5,0.5,Positive, Superrrb qualityREAD MORE
181,181,Nice,Good for mobile not a tabREAD MORE,3Nice,portronics-por-122-modesk-universal-mobile-holder-black,3,0.6,Positive, Good for mobile not a tabREAD MORE
182,182,Simply awesome,Awesome quality Comfortable instrumentREAD MORE,5Simply awesome,portronics-por-122-modesk-universal-mobile-holder-black,5,0.6333333333333333,Positive, Awesome quality Comfortable instrumentREAD MORE
183,183,Awesome,Product is quality 🔥and value for money. Must go for it 👍🏻🤘🏼READ MORE,5Awesome,portronics-por-122-modesk-universal-mobile-holder-black,5,0.5,Positive, Product is quality 🔥and value for money. Must go for it 👍🏻🤘🏼READ MORE
184,184,Value-for-money,Very nice product good quality 👌👌READ MORE,4Value-for-money,portronics-por-122-modesk-universal-mobile-holder-black,4,0.66,Positive, Very nice product good quality 👌👌READ MORE
185,185,Worth the money,UsefullREAD MORE,4Worth the money,portronics-por-122-modesk-universal-mobile-holder-black,4,0.5,Positive, UsefullREAD MORE
186,186,Just wow!,Worthy of moneyREAD MORE,5Just wow!,portronics-por-122-modesk-universal-mobile-holder-black,5,0.41666666666666663,Positive, Worthy of moneyREAD MORE
187,187,Good,"Not worth more than 100 Rs.Pain quality not up to the mark,Too rough surface.Not a quality product.READ MORE",3Good,portronics-por-122-modesk-universal-mobile-holder-black,3,0.1875,Positive," Not worth more than 100 Rs.Pain quality not up to the mark,Too rough surface.Not a quality product.READ MORE"
188,188,Terrible product,Very bad quality... Finishing not goodPhone Adjestmenst very bad...READ MORE,1Terrible product,portronics-por-122-modesk-universal-mobile-holder-black,1,-0.06999999999999991,Negative, Very bad quality... Finishing not goodPhone Adjestmenst very bad...READ MORE
189,189,Excellent,Best priceREAD MORE,5Excellent,portronics-por-122-modesk-universal-mobile-holder-black,5,0.75,Positive, Best priceREAD MORE
190,190,Bad quality,Not worth for 149....holding hands are narrow...it should be little wide...my friend also has a stand which is same price and very good quality from this productREAD MORE,2Bad quality,portronics-por-122-modesk-universal-mobile-holder-black,2,0.21449999999999997,Positive, Not worth for 149....holding hands are narrow...it should be little wide...my friend also has a stand which is same price and very good quality from this productREAD MORE
191,191,Pretty good,Good...READ MORE,4Pretty good,portronics-por-122-modesk-universal-mobile-holder-black,4,0.5,Positive, Good...READ MORE
192,192,Good quality product,It is very useful to online classesREAD MORE,4Good quality product,portronics-por-122-modesk-universal-mobile-holder-black,4,0.445,Positive, It is very useful to online classesREAD MORE
193,193,Simply awesome,Really helpful for online classesREAD MORE,5Simply awesome,portronics-por-122-modesk-universal-mobile-holder-black,5,0.35,Positive, Really helpful for online classesREAD MORE
194,194,Really Nice,Nyc products For only 99READ MORE,4Really Nice,portronics-por-122-modesk-universal-mobile-holder-black,4,0.25,Positive, Nyc products For only 99READ MORE
195,195,Worth every penny,Quality is prity good.READ MORE,5Worth every penny,portronics-por-122-modesk-universal-mobile-holder-black,5,0.5,Positive, Quality is prity good.READ MORE
196,196,Value-for-money,Such a good product!!  It really very useful for online study by smart Phone.READ MORE,4Value-for-money,portronics-por-122-modesk-universal-mobile-holder-black,4,0.4208571428571428,Positive, Such a good product!! It really very useful for online study by smart Phone.READ MORE
197,197,Good choice,Nice 🙂 Very Good...This Product is Very Useful .......Wow....Awesome 😎READ MORE,4Good choice,portronics-por-122-modesk-universal-mobile-holder-black,4,0.4225,Positive, Nice 🙂 Very Good...This Product is Very Useful .......Wow....Awesome 😎READ MORE
198,198,Wonderful,Very useful product. Easy to use and carry as well. Highly recommendedREAD MORE,5Wonderful,portronics-por-122-modesk-universal-mobile-holder-black,5,0.37083333333333335,Positive, Very useful product. Easy to use and carry as well.
199,199,Useless product,The holder is not flexible and does not move. Can only use it at one particular angle.READ MORE,1Useless product,portronics-por-122-modesk-universal-mobile-holder-black,1,0.2222222222222222,Positive, The holder is not flexible and does not move. Can only use it at one particular angle.READ MORE
200,200,Awesome,good one with good and almost accurate readings. We use this device to know the current  blood pressure range  readings rather than intend to have perfect reading...becoz...Blood pressure various for many many reasons . My advice is to use this device reading as reference and consult Doctor incase of higher continuous readings..READ MORE,5Awesome,omron-hem-7124-bp-monitor,5,0.45499999999999996,Positive, good one with good and almost accurate readings. We use this device to know the current  blood pressure range  readings rather than intend to have perfect reading...becoz...Blood pressure various for many many reasons . My advice is to use this device reading as reference and consult Doctor incase of higher continuous readings..READ MORE
201,201,Worth every penny,nice packaging and this dp monitor are very useful and measurement are showing right i love it. quality are too good thank you FlipkartREAD MORE,5Worth every penny,omron-hem-7124-bp-monitor,5,0.495952380952381,Positive, nice packaging and this dp monitor are very useful and measurement are showing right i love it.
202,202,Pretty good,"Received the product today. In absolutely good condition.Coming to the product, it is a good product which gives near to  accurate results. Really happy to receive a product like this within this price range. Screenshot of the Omron Connect app has also been attached.READ MORE",4Pretty good,omron-hem-7124-bp-monitor,4,0.5333333333333333,Positive," Received the product today. In absolutely good condition.Coming to the product, it is a good product which gives near to  accurate results. Really happy to receive a product like this within this price range. Screenshot of the Omron Connect app has also been attached.READ MORE"
203,203,Nice product,"Omron BP monitor HEM-7124 is user-friendly product. Easy to use, easy to take reading. It's also indicate hypertension if present. Can hold last memory. But problem is that it's show different results in every different measurement, so kindly take e average value of systolic pressure and dystolis pressure for your convenience. Otherwise good product to use.READ MORE",4Nice product,omron-hem-7124-bp-monitor,4,0.25166666666666665,Positive," Omron BP monitor HEM-7124 is user-friendly product. Easy to use, easy to take reading. It's also indicate hypertension if present. Can hold last memory. But problem is that it's show different results in every different measurement, so kindly take e average value of systolic pressure and dystolis pressure for your convenience. Otherwise good product to use.READ MORE"
204,204,Waste of money!,it doesn't give correct results. if you will check again after 5 second it will show very different results. so its not good for checking BP. not recommendedREAD MORE,1Waste of money!,omron-hem-7124-bp-monitor,1,0.037500000000000006,Positive, it doesn't give correct results. if you will check again after 5 second it will show very different results. so its not good for checking BP.
205,205,Very Good,"overall good but u have to check bp 2 times in same arm then it will give correct reading ,first reading is almost correct but not always correctREAD MORE",4Very Good,omron-hem-7124-bp-monitor,4,0.29,Positive," overall good but u have to check bp 2 times in same arm then it will give correct reading ,first reading is almost correct but not always correctREAD MORE"
206,206,Awesome,very good very useful in helping you thank youREAD MORE,5Awesome,omron-hem-7124-bp-monitor,5,0.6,Positive, very good very useful in helping you thank youREAD MORE
207,207,Good BP Monitor,"My parents have been using this brand for over 8+ years so I decided to go with this one. The build is solid. The box mentions manufacturing of this unit at vietnam and the pressure sensor as produced in Japan.  There is no AC adapter, only batteries. Adapter can be purchased separately.As for readings- I was told by a Dr that none of the digital home monitors give as accurate readings as the mercury based monitor used in the Dr's office. These monitors are to be used only for general indica...READ MORE",5Good BP Monitor,omron-hem-7124-bp-monitor,5,0.13571428571428573,Positive," My parents have been using this brand for over 8+ years so I decided to go with this one. The box mentions manufacturing of this unit at vietnam and the pressure sensor as produced in Japan. There is no AC adapter, only batteries. Adapter can be purchased separately.As for readings- I was told by a Dr that none of the digital home monitors give as accurate readings as the mercury based monitor used in the Dr's office. These monitors are to be used only for general indica...READ MORE"
208,208,Highly recommended,"Excellent produc by Omron & rocket delivery by Flipkart. As per as the product is concern, it's give absolutely accurate reading both systolic & diastolic bp as well as pulse rate. I have cross checked 10 times in different times & person with murcurry bp machine with stethoscope.READ MORE",5Highly recommended,omron-hem-7124-bp-monitor,5,0.38,Positive," Excellent produc by Omron & rocket delivery by Flipkart. As per as the product is concern, it's give absolutely accurate reading both systolic & diastolic bp as well as pulse rate. I have cross checked 10 times in different times & person with murcurry bp machine with stethoscope.READ MORE"
209,209,Great product,Amazing Delivery at such a Lockdown time...Really helpful. Packaging and all excellent and Product is rated 9.6 and among the best one for 2020...Very simple to use...Had lot of time so wrote in detail..READ MORE,5Great product,omron-hem-7124-bp-monitor,5,0.5166666666666667,Positive, Amazing Delivery at such a Lockdown time...Really helpful. Packaging and all excellent and Product is rated 9.6 and among the best one for 2020...Very simple to use...Had lot of time so wrote in detail..READ MORE
210,210,Must buy!,Good product highly recommended in this price range. As the product shows close to accurate and its handy too.READ MORE,5Must buy!,omron-hem-7124-bp-monitor,5,0.472,Positive, Good product highly recommended in this price range. As the product shows close to accurate and its handy too.READ MORE
211,211,Really Nice,I bought it because of its brand value. Omron is a well known and trustworthy brand for the healthcare devices. After went through some credible articles I decided to buy it and I would like to inform you all that Omron did not dissapoint me.  It's easy to use and shows almost accurate data. You can go for the brand without any second thought and  thank you Omron for keeping all the promises about the device you said.READ MORE,4Really Nice,omron-hem-7124-bp-monitor,4,0.3466666666666667,Positive, I bought it because of its brand value. Omron is a well known and trustworthy brand for the healthcare devices. After went through some credible articles I decided to buy it and I would like to inform you all that Omron did not dissapoint me. It's easy to use and shows almost accurate data. You can go for the brand without any second thought and  thank you Omron for keeping all the promises about the device you said.READ MORE
212,212,Best in the market!,"Good packaging and delivery was really very fast , product i received was in good condition & i am satisfied with this product bcoz OMRON is really a trusted brand for such product , overall reading is accurate with +-5 ,Nice thing is about battery which is not reachable but in Duracell pencil battery its can take reading 50+ times,bcoz yet now i used omron more than 25 times but still battery 50% remaining ,shows hypertension, cuff setting, pulse and shows normal & abnormal activities , prod...READ MORE",5Best in the market!,omron-hem-7124-bp-monitor,5,0.3758333333333334,Positive," Good packaging and delivery was really very fast , product i received was in good condition & i am satisfied with this product bcoz OMRON is really a trusted brand for such product , overall reading is accurate with +-5 ,Nice thing is about battery which is not reachable but in Duracell pencil battery its can take reading 50+ times,bcoz yet now i used omron more than 25 times but still battery 50% remaining ,shows hypertension, cuff setting, pulse and shows normal & abnormal activities , prod...READ MORE"
