,Unnamed: 0,review_title,review,rate,category,rating,Polarity,Analysis,summarization
331,331,Classy product,I have ordered this mouse already in the past 4 times. And I always buy this model only for my daily work use. Since I work from home. I am more than happy with this mouse and the delivery was also nice and fast.READ MORE,5Classy product,dell-ms-116-wired-optical-mouse,5,0.3071428571428571,Positive, I have ordered this mouse already in the past 4 times. And I always buy this model only for my daily work use. Since I work from home. I am more than happy with this mouse and the delivery was also nice and fast.READ MORE
332,332,Perfect product!,"Easy to use, the performance is good , it is comfortable to hold .I got the product before the delivery date. Thanks to Flipkart !! :)READ MORE",5Perfect product!,dell-ms-116-wired-optical-mouse,5,0.47430555555555554,Positive," Easy to use, the performance is good , it is comfortable to hold .I got the product before the delivery date. Thanks to Flipkart !"
333,333,Fabulous!,Good product i love this mouse overall perfect But Delivery is too lateI loved it Nice packaging also love flipkart .READ MORE,5Fabulous!,dell-ms-116-wired-optical-mouse,5,0.5625,Positive, Good product i love this mouse overall perfect But Delivery is too lateI loved it Nice packaging also love flipkart .READ MORE
334,334,Classy product,works pretty fine and this is rhe best in range go for itREAD MORE,5Classy product,dell-ms-116-wired-optical-mouse,5,0.5416666666666667,Positive, works pretty fine and this is rhe best in range go for itREAD MORE
335,335,Great product,a best quality mouse you can get in reasonable price.Fine interface and good and smooth to handle.  fittest for office and personal useREAD MORE,5Great product,dell-ms-116-wired-optical-mouse,5,0.4666666666666666,Positive, a best quality mouse you can get in reasonable price.Fine interface and good and smooth to handle.
336,336,Really Nice,good impressive but little bit heavy to hold. product is working nice and flipkart service like all the time superb😎😍READ MORE,4Really Nice,dell-ms-116-wired-optical-mouse,4,0.40208333333333335,Positive, good impressive but little bit heavy to hold. product is working nice and flipkart service like all the time superb😎😍READ MORE
337,337,Best in the market!,"Good quality mouse, recommended for all users who always prefers wired budget mouse, just loved the click sound, the sound which I want Highly recommendedREAD MORE",5Best in the market!,dell-ms-116-wired-optical-mouse,5,0.4766666666666666,Positive," Good quality mouse, recommended for all users who always prefers wired budget mouse, just loved the click sound, the sound which I want Highly recommendedREAD MORE"
338,338,Fabulous!,"Dell MS116 is one of the best products of this range out there. You get a good mouse for cheap price, it's great. The keys function well and the mouse wheel is extremely comfortable to scroll. It is a brilliant low range mouse from Dell. MUST BUY!READ MORE",5Fabulous!,dell-ms-116-wired-optical-mouse,5,0.5875,Positive," Dell MS116 is one of the best products of this range out there. You get a good mouse for cheap price, it's great. The keys function well and the mouse wheel is extremely comfortable to scroll. It is a brilliant low range mouse from Dell."
339,339,Delightful,"Very Good Product. Clicks buttons are so good but scroll while make sound when i shake it on open air. but this is not a problem, because its not broken its designed for long and good life for scroll while. over all its good mouse under 500/-* (i purchase it 385 with delivery charge).  best and better then any ordinary mouse.READ MORE",4Delightful,dell-ms-116-wired-optical-mouse,4,0.44250000000000006,Positive," Very Good Product. Clicks buttons are so good but scroll while make sound when i shake it on open air. but this is not a problem, because its not broken its designed for long and good life for scroll while. over all its good mouse under 500/-* (i purchase it 385 with delivery charge). best and better then any ordinary mouse.READ MORE"
340,340,Worth every penny,Dell is just awesome no issue and wonderful packaging and one day on time delivery very happy with product and flipkart thank you for a great dealREAD MORE,5Worth every penny,dell-ms-116-wired-optical-mouse,5,0.86,Positive, Dell is just awesome no issue and wonderful packaging and one day on time delivery very happy with product and flipkart thank you for a great dealREAD MORE
341,341,Wonderful,Good in terms of pricing but do not expect much in terms of quality.Very light weight.Clicks are good but the scroll wheel does not feel great and precise.After 5 days of extreme usage the scroll still works good and the clicks sound the same.Will definitely update this review after 1 months of use as wellREAD MORE,4Wonderful,dell-ms-116-wired-optical-mouse,4,0.42750000000000005,Positive, Good in terms of pricing but do not expect much in terms of quality.Very light weight.Clicks are good but the scroll wheel does not feel great and precise.After 5 days of extreme usage the scroll still works good and the clicks sound the same.Will definitely update this review after 1 months of use as wellREAD MORE
342,342,Excellent,"I am writing this review after 2 months of use, this mouse is absolutely nice for normal use and gaming as well cuz it can double click and drag click too. It will take some time for double clicking like 2-3 weeks of use, and i know many of you guys who play minecraft will be thinking about the cps, with butterfly click I get 14-18 cps, the most cps i have got is 22 cps, with jitter click I get 13-15 cps i am not that much good at it and with short drag I get 8-12 cps which is really good for...READ MORE",5Excellent,dell-ms-116-wired-optical-mouse,5,0.2874999999999999,Positive," I am writing this review after 2 months of use, this mouse is absolutely nice for normal use and gaming as well cuz it can double click and drag click too. It will take some time for double clicking like 2-3 weeks of use, and i know many of you guys who play minecraft will be thinking about the cps, with butterfly click I get 14-18 cps, the most cps i have got is 22 cps, with jitter click I get 13-15 cps i am not that much good at it and with short drag I get 8-12 cps which is really good for...READ MORE"
343,343,Wonderful,very good. smooth working. .. I have hp mouse also. but hp is best than Dell. very easy to work. Dell also gud.  mark for hp 5/4.5. Dell is 5/4.0. hp is weightless. this little bit weight. wire is premium in Dell. overall value for money. for rough use is Dell best. for soft use hp is best.READ MORE,5Wonderful,dell-ms-116-wired-optical-mouse,5,0.4185833333333333,Positive, very good. smooth working. .. I have hp mouse also. but hp is best than Dell. very easy to work. Dell also gud. mark for hp 5/4.5. Dell is 5/4.0. hp is weightless. this little bit weight. wire is premium in Dell. overall value for money. for rough use is Dell best. for soft use hp is best.READ MORE
344,344,Best in the market!,"Excellent in appearance, design on one hand and effectively working on the other.  * Customer can go for it it's one the best suitable product.Thank you Flipkart, Dell and Newgen (SELLER)                         From my side 5/5                                  *******READ MORE",5Best in the market!,dell-ms-116-wired-optical-mouse,5,0.5875,Positive," * Customer can go for it it's one the best suitable product.Thank you Flipkart, Dell and Newgen (SELLER)                         From my side 5/5                                  *******READ MORE"
345,345,Super!,Best mouse in this price. performance of the mouse is good and also the delivery and packaging service by flip kart. It work's better with dell laptop. 😀READ MORE,5Super!,dell-ms-116-wired-optical-mouse,5,0.675,Positive, Best mouse in this price. performance of the mouse is good and also the delivery and packaging service by flip kart. It work's better with dell laptop.
346,346,Good choice,Good product and runs smooth good product at this price I recommend this is in low pricesREAD MORE,4Good choice,dell-ms-116-wired-optical-mouse,4,0.45999999999999996,Positive, Good product and runs smooth good product at this price I recommend this is in low pricesREAD MORE
347,347,Classy product,Very good product from dell.. And very good grip for hand... Very hardy product as well.. Coz once it fell off from my hand.. Nd still its working completely fine without any glitch..READ MORE,5Classy product,dell-ms-116-wired-optical-mouse,5,0.5873333333333333,Positive, Very good product from dell.. And very good grip for hand... Very hardy product as well.. Coz once it fell off from my hand.. Nd still its working completely fine without any glitch..READ MORE
348,348,Wonderful,"genuine Dell product as described, in timely delivery. 2day I received it with soft invoice bill copy thru mail.Only con is made in China product than that of Indian one.READ MORE",4Wonderful,dell-ms-116-wired-optical-mouse,4,0.3333333333333333,Positive," genuine Dell product as described, in timely delivery. 2day I received it with soft invoice bill copy thru mail.Only con is made in China product than that of Indian one.READ MORE"
349,349,Classy Product with a compromise,"An honest review.Not wasting your time in long reviews, Let get into pros and cons.PROS- 1. Matte black finish. I bet you will fell in love with it as soon as you touch it.2. It is a ergonomically well design. Kudos to Dell for that.3. It has 1000 dpi, so for casual gamers on a budget will love this product.4. Wire is pretty long and no software related issue , Simply plug and play.5. Satisfying clicking noise. Virtually silent.CONS-1. Wobbly middle mouse button. (It might be just...READ MORE",4Classy Product with a compromise,dell-ms-116-wired-optical-mouse,4,0.16025641025641024,Positive," An honest review.Not wasting your time in long reviews, Let get into pros and cons.PROS- 1. Matte black finish. I bet you will fell in love with it as soon as you touch it.2. It is a ergonomically well design. Kudos to Dell for that.3. It has 1000 dpi, so for casual gamers on a budget will love this product.4. Wire is pretty long and no software related issue , Simply plug and play.5. Satisfying clicking noise. Virtually silent.CONS-1. Wobbly middle mouse button. (It might be just...READ MORE"
350,350,Just wow!,I have got the perfect optical mouse and it's working very efficiently or smoothly and that's enough for me thank you Flipkart ✨️☺️READ MORE,5Just wow!,dell-ms-116-wired-optical-mouse,5,0.42000000000000004,Positive, I have got the perfect optical mouse and it's working very efficiently or smoothly and that's enough for me thank you Flipkart ✨️☺️READ MORE
351,351,Highly recommended,Best mouse for daily use and its scroll button is the best part it has a rubber texture which gives it a premium look and make it comfortableREAD MORE,5Highly recommended,dell-ms-116-wired-optical-mouse,5,0.625,Positive, Best mouse for daily use and its scroll button is the best part it has a rubber texture which gives it a premium look and make it comfortableREAD MORE
352,352,Good choice,Nice for working but for playing games like GTA nd all it's not that great..Overall good for working nd other work not for games..Nrml games can be played only with this mouse.READ MORE,4Good choice,dell-ms-116-wired-optical-mouse,4,0.33499999999999996,Positive, Nice for working but for playing games like GTA nd all it's not that great..Overall good for working nd other work not for games..Nrml games can be played only with this mouse.READ MORE
353,353,Best in the market!,Highly recommended.It is looking perfect and good quality .If u want to buy a midrange mouse I would like to recommend it.READ MORE,5Best in the market!,dell-ms-116-wired-optical-mouse,5,0.59,Positive, Highly recommended.It is looking perfect and good quality .If u want to buy a midrange mouse I would like to recommend it.READ MORE
354,354,Brilliant,"Nice pick at this price, fits in the hand, scroll works perfectly. It's a good choice if you are looking a wired mouse at this price.READ MORE",5Brilliant,dell-ms-116-wired-optical-mouse,5,0.6,Positive," Nice pick at this price, fits in the hand, scroll works perfectly. It's a good choice if you are looking a wired mouse at this price.READ MORE"
355,355,Mind-blowing purchase,"Excellent and at best price!! I ordered this mouse without second thought when my brother wanted one for his work.  Because I had bought this mouse 1 years back for my own use and it has been working perfectly till date. Easy to use, no strain for palm and fingers evenwhile using for long time. Go for it.READ MORE",5Mind-blowing purchase,dell-ms-116-wired-optical-mouse,5,0.4981481481481482,Positive," I ordered this mouse without second thought when my brother wanted one for his work. Because I had bought this mouse 1 years back for my own use and it has been working perfectly till date. Easy to use, no strain for palm and fingers evenwhile using for long time."
356,356,Worth every penny,what a awesome  mouse fully silent and i  used it for gaming and it the best used mouse for meREAD MORE,5Worth every penny,dell-ms-116-wired-optical-mouse,5,0.625,Positive, what a awesome  mouse fully silent and i  used it for gaming and it the best used mouse for meREAD MORE
357,357,Worth every penny,awesome mouse at affordable price ~~mouse works stunningly perfect on my pc ~~ well hats off to Ekart Logistics they delivered my mouse widin 2 days whereas expected delivery was after 7 days ~~ thanks to flipkart to bring us such a good product ~~guys go for it if ure  looking for such a good product in less priceREAD MORE,5Worth every penny,dell-ms-116-wired-optical-mouse,5,0.38333333333333336,Positive, awesome mouse at affordable price ~~mouse works stunningly perfect on my pc ~~ well hats off to Ekart Logistics they delivered my mouse widin 2 days whereas expected delivery was after 7 days ~~ thanks to flipkart to bring us such a good product ~~guys go for it if ure  looking for such a good product in less priceREAD MORE
358,358,Nice product,"I'm technically not a savvy guy but after using the product for a while I found it quite convenient to handle comparing to the previous one I used. It's neither heavy nor too light weighted.It's really a superb product. Response is good . At this price rate having this kind of product , I think I have got the full value of my money.And regarding Flipkart , what to say about ? Right from the placement of order to the delivery of the product everything they have done so smoothly. But only requ...READ MORE",4Nice product,dell-ms-116-wired-optical-mouse,4,0.3224206349206349,Positive," I'm technically not a savvy guy but after using the product for a while I found it quite convenient to handle comparing to the previous one I used. It's neither heavy nor too light weighted.It's really a superb product. At this price rate having this kind of product , I think I have got the full value of my money.And regarding Flipkart , what to say about ? Right from the placement of order to the delivery of the product everything they have done so smoothly."
359,359,Awesome,"Well , i have listen about dell products are very durable and long lasting but i have didn't any product of dell therefore to experience dell i purchase dell mouse . It gives a premium look also the plastic used in mouse is good & during using it is very comfortable , just go for it if your budget is tight :)READ MORE",5Awesome,dell-ms-116-wired-optical-mouse,5,0.2739285714285714,Positive," Well , i have listen about dell products are very durable and long lasting but i have didn't any product of dell therefore to experience dell i purchase dell mouse . It gives a premium look also the plastic used in mouse is good & during using it is very comfortable , just go for it if your budget is tight :)READ MORE"
360,360,Good,i dont like it it is good at this price but i dont like itREAD MORE,3Good,dell-ms-116-wired-optical-mouse,3,0.6,Positive, i dont like it it is good at this price but i dont like itREAD MORE
361,361,Good,"I just bought it. Its branded so it carries a degree of goodwill which stands behind it.Long cord, easy grip, smooth scroll will and soft clicks, light weight.Ideal for office work, not much suitable for gaming; probably because of the big studs at the bottom causing too much fatigue.Not much sturdy.All in all a good product for everyday work.READ MORE",3Good,dell-ms-116-wired-optical-mouse,3,0.1715277777777778,Positive," Its branded so it carries a degree of goodwill which stands behind it.Long cord, easy grip, smooth scroll will and soft clicks, light weight.Ideal for office work, not much suitable for gaming; probably because of the big studs at the bottom causing too much fatigue.Not much sturdy.All in all a good product for everyday work.READ MORE"
362,362,Pretty good,Actually really good product...delivered in proper packing and good condition..since its been an year of using...but still good condtion..loved it....READ MORE,4Pretty good,dell-ms-116-wired-optical-mouse,4,0.5199999999999999,Positive, Actually really good product...delivered in proper packing and good condition..since its been an year of using...but still good condtion..loved it....READ MORE
363,363,Awesome,Too good . bought this for daily use .i will recommend pls don't give a second thought just buy the product . PerfectREAD MORE,5Awesome,dell-ms-116-wired-optical-mouse,5,0.3,Positive, bought this for daily use .i will recommend pls don't give a second thought just buy the product .
364,364,Best in the market!,So good to have it. Dell one of my Favourite Brand. Guys go for it. Value for Money product. Super Fast experience 🔥🔥❤️READ MORE,5Best in the market!,dell-ms-116-wired-optical-mouse,5,0.4333333333333333,Positive, So good to have it. Dell one of my Favourite Brand. Guys go for it. Value for Money product. Super Fast experience 🔥🔥❤️READ MORE
365,365,Nice product,Thanks flipkart for super fast delivery ... The product is in good condition working well upload review after using itREAD MORE,4Nice product,dell-ms-116-wired-optical-mouse,4,0.38666666666666666,Positive, Thanks flipkart for super fast delivery ... The product is in good condition working well upload review after using itREAD MORE
366,366,Awesome,Very Good product. Feel very smoothly and work very Good. I suggest for every one to buy this mouse.READ MORE,5Awesome,dell-ms-116-wired-optical-mouse,5,0.71,Positive, Very Good product. Feel very smoothly and work very Good. I suggest for every one to buy this mouse.READ MORE
367,367,Best in the market!,"Works really nice. Design: very simple and elegant design and simple to use.Performance: Early days will have tough button press but later on it becomes soft and easy to use.Final verdict: Great product at this range, just for this if not opting for wireless mouse.READ MORE",5Best in the market!,dell-ms-116-wired-optical-mouse,5,0.24040404040404043,Positive," Design: very simple and elegant design and simple to use.Performance: Early days will have tough button press but later on it becomes soft and easy to use.Final verdict: Great product at this range, just for this if not opting for wireless mouse.READ MORE"
368,368,Fabulous!,The build quality is good. Very comfortable and smoothly working. The wire is too long so you can use it from 1-2 mtr distance using megnifier option in desktop. Overall product is genuine and easy to use.READ MORE,5Fabulous!,dell-ms-116-wired-optical-mouse,5,0.36291666666666667,Positive, The build quality is good. Very comfortable and smoothly working. The wire is too long so you can use it from 1-2 mtr distance using megnifier option in desktop. Overall product is genuine and easy to use.READ MORE
369,369,Very Good,Till now the product is working awesome... It looks damn classy and a bit modern touch... nice product with a very fair price.READ MORE,4Very Good,dell-ms-116-wired-optical-mouse,4,0.5516666666666666,Positive, Till now the product is working awesome... It looks damn classy and a bit modern touch... nice product with a very fair price.READ MORE
370,370,Awesome,"The best optical mouse you can buy now. Nice design, holds really well in our hands. Would recommend everyone to buy thisREAD MORE",5Awesome,dell-ms-116-wired-optical-mouse,5,0.575,Positive," The best optical mouse you can buy now. Nice design, holds really well in our hands. Would recommend everyone to buy thisREAD MORE"
371,371,Just wow!,"Works very well , smooth , good technology 💗READ MORE",5Just wow!,dell-ms-116-wired-optical-mouse,5,0.45,Positive," Works very well , smooth , good technology 💗READ MORE"
372,372,Perfect product!,"Nice product. Good wire length. Good size, easy to useREAD MORE",5Perfect product!,dell-ms-116-wired-optical-mouse,5,0.5866666666666667,Positive," Nice product. Good wire length. Good size, easy to useREAD MORE"
373,373,Brilliant,"awesomerough and tough product from dell with good warrantyvery durable mouse comfortable to hold having soft click recommended for gaming, office , as well as normal use using since last year ,, facing no problems...superb...must buy.....worth every penny.... can find better mouse than this in this price rangeREAD MORE",5Brilliant,dell-ms-116-wired-optical-mouse,5,0.24513888888888888,Positive," awesomerough and tough product from dell with good warrantyvery durable mouse comfortable to hold having soft click recommended for gaming, office , as well as normal use using since last year ,, facing no problems...superb...must buy.....worth every penny.... can find better mouse than this in this price rangeREAD MORE"
374,374,Value-for-money,Worth the money. Good quality. Reliable. If used properly it can last for more than a year.READ MORE,4Value-for-money,dell-ms-116-wired-optical-mouse,4,0.3333333333333333,Positive, Worth the money. Good quality. Reliable. If used properly it can last for more than a year.READ MORE
375,375,Value-for-money,"This is a well balanced mouse. The design is very comfortable to hold and the clicks are a bit hard, but niceREAD MORE",4Value-for-money,dell-ms-116-wired-optical-mouse,4,0.24277777777777776,Positive," This is a well balanced mouse. The design is very comfortable to hold and the clicks are a bit hard, but niceREAD MORE"
376,376,Just wow!,"I got it in time and in proper condition. This is good enough to work with. Well, this is flexible at the same time.READ MORE",5Just wow!,dell-ms-116-wired-optical-mouse,5,0.24,Positive," I got it in time and in proper condition. This is good enough to work with. Well, this is flexible at the same time.READ MORE"
377,377,Brilliant,"Nice design for better grip. Good support . I ran this on windows 10 ,  Some Linux distros like Ubuntu, Kubuntu, openSUSE.READ MORE",5Brilliant,dell-ms-116-wired-optical-mouse,5,0.575,Positive," Nice design for better grip. I ran this on windows 10 ,  Some Linux distros like Ubuntu, Kubuntu, openSUSE.READ MORE"
378,378,Good choice,I like this one. Looks exactly like the picture provided. Works fine. Loved it.READ MORE,4Good choice,dell-ms-116-wired-optical-mouse,4,0.4666666666666667,Positive, I like this one. Looks exactly like the picture provided. Works fine. Loved it.READ MORE
379,379,Awesome,Nice product finally got a good mouse for my PC it's working well a got it in a very affordable price must buy.READ MORE,5Awesome,dell-ms-116-wired-optical-mouse,5,0.39999999999999997,Positive, Nice product finally got a good mouse for my PC it's working well a got it in a very affordable price must buy.READ MORE
380,380,Must buy!,Great printer. The color reproduction on the pages are crisp and crystal clear. Much faster ppm compared to printers of other companies. Scanning pages feel like a breeze. Awesome overall experience. Highly recommended.READ MORE,5Must buy!,epson-l3110-multi-function-color-printer,5,0.3205555555555556,Positive, Great printer. The color reproduction on the pages are crisp and crystal clear. Much faster ppm compared to printers of other companies. Scanning pages feel like a breeze. Awesome overall experience. Highly recommended.READ MORE
381,381,Wonderful,good priinter at the pricebut as i expect ink is draining ot fastand the colour photographs like mobile clicked imagesit is not printing well colour saturation is 👎 poorbut I m happy when I listened it can automatically clean cartridge nozzle because before i experienced with hp2131 cartridge so good in that fieldREAD MORE,4Wonderful,epson-l3110-multi-function-color-printer,4,0.6444444444444445,Positive, good priinter at the pricebut as i expect ink is draining ot fastand the colour photographs like mobile clicked imagesit is not printing well colour saturation is 👎 poorbut I m happy when I listened it can automatically clean cartridge nozzle because before i experienced with hp2131 cartridge so good in that fieldREAD MORE
382,382,Very poor,"Not a very user friendly printer..Canon in this price range will be a good deal. Not even printed 20 pages and had to schedule three engineer visits. This printer has a problem of reaching ink to head which their engineer resolves by doing a manual suction using disposable syringe, not a worth and trustworthy printer to buy.READ MORE",1Very poor,epson-l3110-multi-function-color-printer,1,0.265,Positive," Not a very user friendly printer..Canon in this price range will be a good deal. Not even printed 20 pages and had to schedule three engineer visits. This printer has a problem of reaching ink to head which their engineer resolves by doing a manual suction using disposable syringe, not a worth and trustworthy printer to buy.READ MORE"
