,Unnamed: 0,review_title,review,rate,category,rating,Polarity,Analysis,summarization
432,432,Must buy!,great product working absolutely fine. flipkart delivery was also good. best product in this range.READ MORE,5Must buy!,epson-l3110-multi-function-color-printer,5,0.6833333333333333,Positive, great product working absolutely fine. flipkart delivery was also good. best product in this range.READ MORE
433,433,Good,Makes Lot of Sound.READ MORE,3Good,epson-l3110-multi-function-color-printer,3,0.5,Positive, Makes Lot of Sound.READ MORE
434,434,Mind-blowing purchase,Excellent as defined suitable for small business.READ MORE,5Mind-blowing purchase,epson-l3110-multi-function-color-printer,5,0.45,Positive, Excellent as defined suitable for small business.READ MORE
435,435,Perfect product!,Nothing like anything.....READ MORE,5Perfect product!,epson-l3110-multi-function-color-printer,5,0.5,Positive, Nothing like anything.....READ MORE
436,436,Mind-blowing purchase,NiceREAD MORE,5Mind-blowing purchase,epson-l3110-multi-function-color-printer,5,0.5,Positive, NiceREAD MORE
437,437,Wonderful,I was really confused between this one and brother printer but made up my mind for this. very good buy. go for itREAD MORE,5Wonderful,epson-l3110-multi-function-color-printer,5,0.3366666666666666,Positive, I was really confused between this one and brother printer but made up my mind for this. very good buy.
438,438,Terrific purchase,goodREAD MORE,5Terrific purchase,epson-l3110-multi-function-color-printer,5,0.5,Positive, goodREAD MORE
439,439,Awesome,Value for moneyREAD MORE,5Awesome,epson-l3110-multi-function-color-printer,5,0.5,Positive, Value for moneyREAD MORE
440,440,Worthless,"Waste of money, time and energyThe machine works good only for 1-2 weeks after the if you are lucky it would work few more days.Poor support but I used to call them daily and managed to get replacement but the replacement was faulty, I replaced the replaced project. But even that worked for just 2 weeks.They give a usb cable to charge the scale, only that works good , I suggest they can just start selling usb cables.I am obbessed and don't have time to do this process again.I bought thi...READ MORE",1Worthless,dr-trust-usa-executive-rechargeable-digital-weighing-scale-electronic-weight-machine-human-body-temperature-display-usb-cable-included,1,0.2333333333333333,Positive," Waste of money, time and energyThe machine works good only for 1-2 weeks after the if you are lucky it would work few more days.Poor support but I used to call them daily and managed to get replacement but the replacement was faulty, I replaced the replaced project. But even that worked for just 2 weeks.They give a usb cable to charge the scale, only that works good , I suggest they can just start selling usb cables.I am obbessed and don't have time to do this process again.I bought thi...READ MORE"
441,441,Utterly Disappointed,"It's not good please don't go for it.. Weighing machine doesn't show accurate weight... Every time u check the weight the machine shows different weight. In a span of 2 mins, the weighing machine shows a difference of at least 2-3kgs.. A person cannot gain a weight of 2-3kilos in 2mims..READ MORE",1Utterly Disappointed,dr-trust-usa-executive-rechargeable-digital-weighing-scale-electronic-weight-machine-human-body-temperature-display-usb-cable-included,1,0.050000000000000024,Positive," Weighing machine doesn't show accurate weight... Every time u check the weight the machine shows different weight. In a span of 2 mins, the weighing machine shows a difference of at least 2-3kgs.. A person cannot gain a weight of 2-3kilos in 2mims..READ MORE"
442,442,Just wow!,I got this weight machine on April 25. The building and Finishing is top notch. The front upper part where you will put your feet is made of somekind of toughened glass of about 0.6cm thickness. It has a appropriately sized digital display of 6cmx2.5cm. The number letters are yellow in color with a navy blue color background. The design of the front part is really nice and eyecatching. The product dimension as I measured is around 28cmx23cm with rounded edges. The rear side as you can see in ...READ MORE,5Just wow!,dr-trust-usa-executive-rechargeable-digital-weighing-scale-electronic-weight-machine-human-body-temperature-display-usb-cable-included,5,0.2625,Positive, I got this weight machine on April 25. The building and Finishing is top notch. The front upper part where you will put your feet is made of somekind of toughened glass of about 0.6cm thickness. It has a appropriately sized digital display of 6cmx2.5cm. The number letters are yellow in color with a navy blue color background. The design of the front part is really nice and eyecatching. The product dimension as I measured is around 28cmx23cm with rounded edges. The rear side as you can see in ...READ MORE
443,443,Super!,Dr trust an awesome weighing machine build quality is nice good product and the price is reasonable shows the weight correctly minimum weight 5 kg maximum weight I can check up to 180 kg the package was nice the packing condition was good Flipkart delivery in time as they agreed they gave the thermometer and tape extra with the weighing machine  simply superb every penny worth give five star wonderful to all you guys without thinking Just Go With It mind-boggling.READ MORE,5Super!,dr-trust-usa-executive-rechargeable-digital-weighing-scale-electronic-weight-machine-human-body-temperature-display-usb-cable-included,5,0.6,Positive, Dr trust an awesome weighing machine build quality is nice good product and the price is reasonable shows the weight correctly minimum weight 5 kg maximum weight I can check up to 180 kg the package was nice the packing condition was good Flipkart delivery in time as they agreed they gave the thermometer and tape extra with the weighing machine  simply superb every penny worth give five star wonderful to all you guys without thinking Just Go With It mind-boggling.READ MORE
444,444,Classy product,"I searched for many products for digital weighing scale online, but trust me guys this is the best deal I have found here. Thanks Flipkart. it is exactly what you see in the description. Classy, No removable battery, just recharge using usb and use it. Totally happy with the quality. Don't think twice. Just buy it. You will definitely love it like me.READ MORE",5Classy product,dr-trust-usa-executive-rechargeable-digital-weighing-scale-electronic-weight-machine-human-body-temperature-display-usb-cable-included,5,0.42777777777777776,Positive," I searched for many products for digital weighing scale online, but trust me guys this is the best deal I have found here. Thanks Flipkart. it is exactly what you see in the description. Classy, No removable battery, just recharge using usb and use it. Totally happy with the quality. Don't think twice. Just buy it. You will definitely love it like me.READ MORE"
445,445,Awesome,"Excellent product , received it in very good condition and good packing by the seller. Also there was a complimentary items inside the box (Thermometer 1no and Fixable Measurement Tape).overall product is very good.READ MORE",5Awesome,dr-trust-usa-executive-rechargeable-digital-weighing-scale-electronic-weight-machine-human-body-temperature-display-usb-cable-included,5,0.6016666666666667,Positive," Excellent product , received it in very good condition and good packing by the seller. Also there was a complimentary items inside the box (Thermometer 1no and Fixable Measurement Tape).overall product is very good.READ MORE"
446,446,Fabulous!,"Precise & Sober I liked the product, as it  shows perfect weight and room temperature. Also Got complementary measuring tape and thermometer. Worth to buy.READ MORE",5Fabulous!,dr-trust-usa-executive-rechargeable-digital-weighing-scale-electronic-weight-machine-human-body-temperature-display-usb-cable-included,5,0.48333333333333334,Positive," Precise & Sober I liked the product, as it  shows perfect weight and room temperature. Also Got complementary measuring tape and thermometer."
447,447,Delightful,My first product is rip in just 3 week. But the best think & experience of mine is I called customer care for that issue they quickly respond me by exchange that product. Wow it's really easy by solving problems. Yes now I must say that will Trust as Dr. Trust. Go for it. Jai hind.READ MORE,4Delightful,dr-trust-usa-executive-rechargeable-digital-weighing-scale-electronic-weight-machine-human-body-temperature-display-usb-cable-included,4,0.4361111111111111,Positive, My first product is rip in just 3 week. But the best think & experience of mine is I called customer care for that issue they quickly respond me by exchange that product. Wow it's really easy by solving problems. Yes now I must say that will Trust as Dr. Trust. Jai hind.READ MORE
448,448,Super!,i just bought it....till now it shows great accuracy easy to use...in my point of view best product in this sort of priceREAD MORE,5Super!,dr-trust-usa-executive-rechargeable-digital-weighing-scale-electronic-weight-machine-human-body-temperature-display-usb-cable-included,5,0.6833333333333333,Positive, i just bought it....till now it shows great accuracy easy to use...in my point of view best product in this sort of priceREAD MORE
449,449,Terrific,Nice weighting Machine scale. Free gifts are good too. But showing different readings sometimes. Overall nice value for money product.READ MORE,5Terrific,dr-trust-usa-executive-rechargeable-digital-weighing-scale-electronic-weight-machine-human-body-temperature-display-usb-cable-included,5,0.39999999999999997,Positive, Nice weighting Machine scale. Free gifts are good too. But showing different readings sometimes. Overall nice value for money product.READ MORE
450,450,Super!,Dr. Trust is a good weight scale I bought for 1199rs comes with Digital and rechargable. The weight accuracy is too good & shows room temperature with absolutely perfect. and battery backup is awesome. I recommend who are looking for weight machine should buy this.READ MORE,5Super!,dr-trust-usa-executive-rechargeable-digital-weighing-scale-electronic-weight-machine-human-body-temperature-display-usb-cable-included,5,0.65,Positive, Dr. Trust is a good weight scale I bought for 1199rs comes with Digital and rechargable. The weight accuracy is too good & shows room temperature with absolutely perfect. I recommend who are looking for weight machine should buy this.READ MORE
451,451,Awesome,Very nice product from Drtrust .The measurement from the device is accurate and it have also free measurement tape of length 150 cm which is very useful and the tape is made of plastic ; so it wont get very dirty.The look of the device is very stylIsh  and attractive .and it also have free thermometer . Very cool product ; EVERYONE SHOULD HAVE ONE !!!!READ MORE,5Awesome,dr-trust-usa-executive-rechargeable-digital-weighing-scale-electronic-weight-machine-human-body-temperature-display-usb-cable-included,5,0.552,Positive, Very nice product from Drtrust .The measurement from the device is accurate and it have also free measurement tape of length 150 cm which is very useful and the tape is made of plastic ; so it wont get very dirty.The look of the device is very stylIsh  and attractive .and it also have free thermometer . Very cool product ; EVERYONE SHOULD HAVE ONE !
452,452,Value-for-money,"very good product at reasonable price ,best part is automatic power on off feature and also it comes with free gifts which are also very usefulREAD MORE",5Value-for-money,dr-trust-usa-executive-rechargeable-digital-weighing-scale-electronic-weight-machine-human-body-temperature-display-usb-cable-included,5,0.535,Positive," very good product at reasonable price ,best part is automatic power on off feature and also it comes with free gifts which are also very usefulREAD MORE"
453,453,Terrific purchase,"very good product at reasonable price ,best part is automatic power on off feature and also it comes with free gifts which are also very usefulREAD MORE",5Terrific purchase,dr-trust-usa-executive-rechargeable-digital-weighing-scale-electronic-weight-machine-human-body-temperature-display-usb-cable-included,5,0.535,Positive," very good product at reasonable price ,best part is automatic power on off feature and also it comes with free gifts which are also very usefulREAD MORE"
454,454,Best in the market!,loved the product it's amazing worth money and they gave measuring tape and thermometer which is very useful thank you 😊READ MORE,5Best in the market!,dr-trust-usa-executive-rechargeable-digital-weighing-scale-electronic-weight-machine-human-body-temperature-display-usb-cable-included,5,0.49800000000000005,Positive, loved the product it's amazing worth money and they gave measuring tape and thermometer which is very useful thank you 😊READ MORE
455,455,Wonderful,good product easy to use. I would like to recommend it to othersREAD MORE,4Wonderful,dr-trust-usa-executive-rechargeable-digital-weighing-scale-electronic-weight-machine-human-body-temperature-display-usb-cable-included,4,0.5444444444444444,Positive, good product easy to use. I would like to recommend it to othersREAD MORE
456,456,Good choice,"Liked the product. Received it today. It seems accurate. Nice finishing, light weight, looks decent n premium. Bought it for 854 while there was discount. Look the image for ur reference.READ MORE",4Good choice,dr-trust-usa-executive-rechargeable-digital-weighing-scale-electronic-weight-machine-human-body-temperature-display-usb-cable-included,4,0.4444444444444444,Positive," Liked the product. Received it today. It seems accurate. Nice finishing, light weight, looks decent n premium. Bought it for 854 while there was discount. Look the image for ur reference.READ MORE"
457,457,Awesome,It's really a nice product to check weight. Every family should have this product to maintain themselves. Thanks to flipkart by giving delivery on time with Proper packing. Really this one is very nice product with very attractive look.READ MORE,5Awesome,dr-trust-usa-executive-rechargeable-digital-weighing-scale-electronic-weight-machine-human-body-temperature-display-usb-cable-included,5,0.4685714285714286,Positive, It's really a nice product to check weight. Every family should have this product to maintain themselves. Thanks to flipkart by giving delivery on time with Proper packing. Really this one is very nice product with very attractive look.READ MORE
458,458,Must buy!,one of the best weighing scale ever used. The weight reading is accurate and is very steady while in use. I would recommend it to all.READ MORE,5Must buy!,dr-trust-usa-executive-rechargeable-digital-weighing-scale-electronic-weight-machine-human-body-temperature-display-usb-cable-included,5,0.5291666666666667,Positive, one of the best weighing scale ever used. The weight reading is accurate and is very steady while in use. I would recommend it to all.READ MORE
459,459,Worth every penny,very nice product .. it seems to be professional stuff.. beautiful weight machine..loving it.. its rechargable so neend not to buy battery .free gifts are awesomeREAD MORE,5Worth every penny,dr-trust-usa-executive-rechargeable-digital-weighing-scale-electronic-weight-machine-human-body-temperature-display-usb-cable-included,5,0.5575,Positive, very nice product .. it seems to be professional stuff.. beautiful weight machine..loving it.. its rechargable so neend not to buy battery .free gifts are awesomeREAD MORE
460,460,Super!,"Great Product i am using this since two months and now i am writing after using it. quality is good not a single time i have to recharge the product and looking very stylish. nice packing, accurate measurements, no scratches and trust of doctors thanks. comes with supplementry thermometer and measuring tape.READ MORE",5Super!,dr-trust-usa-executive-rechargeable-digital-weighing-scale-electronic-weight-machine-human-body-temperature-display-usb-cable-included,5,0.48571428571428577,Positive," Great Product i am using this since two months and now i am writing after using it. quality is good not a single time i have to recharge the product and looking very stylish. nice packing, accurate measurements, no scratches and trust of doctors thanks. comes with supplementry thermometer and measuring tape.READ MORE"
461,461,Excellent,"Very good product from Dr. Trust it is awesome I have been using it from 10days no, problem. it is showing accurate weight I liked it you can go for it without any doubtREAD MORE",5Excellent,dr-trust-usa-executive-rechargeable-digital-weighing-scale-electronic-weight-machine-human-body-temperature-display-usb-cable-included,5,0.682,Positive," Very good product from Dr. Trust it is awesome I have been using it from 10days no, problem. it is showing accurate weight I liked it you can go for it without any doubtREAD MORE"
462,462,Terrific,"We Purchase This scale & it is really  Good product Good Price Product quality is also very good Glass finishing body, Auto on/off ,LCD indicators & correct weight analysingREAD MORE",5Terrific,dr-trust-usa-executive-rechargeable-digital-weighing-scale-electronic-weight-machine-human-body-temperature-display-usb-cable-included,5,0.7024999999999999,Positive," We Purchase This scale & it is really  Good product Good Price Product quality is also very good Glass finishing body, Auto on/off ,LCD indicators & correct weight analysingREAD MORE"
463,463,Good choice,Good weighing machine. I bought after I tried a lot weighing scale. The weighing is precise and suitable for home use. Major advantage of these machine is that it has chargeable batteries. So you don't have to worry about changing batteries.READ MORE,4Good choice,dr-trust-usa-executive-rechargeable-digital-weighing-scale-electronic-weight-machine-human-body-temperature-display-usb-cable-included,4,0.44250000000000006,Positive, Good weighing machine. I bought after I tried a lot weighing scale. The weighing is precise and suitable for home use. Major advantage of these machine is that it has chargeable batteries. So you don't have to worry about changing batteries.READ MORE
464,464,Simply awesome,"Firstly I would like to mention the way it was packed I felt secured that product would not get damaged. Now about the product, Product looks very durable and the readings are quite accurate. Display brightness is gr8 and product itself it's deeign and makes its look quite elegant and rich. I hope it would work too like the way it looks.READ MORE",5Simply awesome,dr-trust-usa-executive-rechargeable-digital-weighing-scale-electronic-weight-machine-human-body-temperature-display-usb-cable-included,5,0.37083333333333335,Positive," Firstly I would like to mention the way it was packed I felt secured that product would not get damaged. Now about the product, Product looks very durable and the readings are quite accurate. Display brightness is gr8 and product itself it's deeign and makes its look quite elegant and rich. I hope it would work too like the way it looks.READ MORE"
465,465,Value-for-money,"Just go for it if you are on a budget and need a reliable one...been using for a month..umm so far accurate readings ,just keep your head straight and check after a sec when on a scale....Go for bluetooth version of this if you wanna keep a record of daily changes...Hit the buy now option ...READ MORE",4Value-for-money,dr-trust-usa-executive-rechargeable-digital-weighing-scale-electronic-weight-machine-human-body-temperature-display-usb-cable-included,4,0.18333333333333335,Positive," Just go for it if you are on a budget and need a reliable one...been using for a month..umm so far accurate readings ,just keep your head straight and check after a sec when on a scale....Go for bluetooth version of this if you wanna keep a record of daily changes...Hit the buy now option ...READ MORE"
466,466,Delightful,"Works perfectly till the time. If kept in flat area the reading is accurate. Room temperature not effective, oue weight measuring process is just about few seconds, i don't know how the machine measures the room temperature in that short time. overall good purchase.READ MORE",4Delightful,dr-trust-usa-executive-rechargeable-digital-weighing-scale-electronic-weight-machine-human-body-temperature-display-usb-cable-included,4,0.23055555555555557,Positive," Works perfectly till the time. If kept in flat area the reading is accurate. Room temperature not effective, oue weight measuring process is just about few seconds, i don't know how the machine measures the room temperature in that short time."
467,467,Must buy!,"Very nice & giving reliable readings...Comes with an measuring tape (manual), one USB powered small keypad light- pretty handy & one digital thermometer!!!As made of completely toughen glass but toughen glass doesn't feel that tough hence proper care should be taken while using & keeping on floorREAD MORE",5Must buy!,dr-trust-usa-executive-rechargeable-digital-weighing-scale-electronic-weight-machine-human-body-temperature-display-usb-cable-included,5,0.19911111111111116,Positive," Very nice & giving reliable readings...Comes with an measuring tape (manual), one USB powered small keypad light- pretty handy & one digital thermometer!! !As made of completely toughen glass but toughen glass doesn't feel that tough hence proper care should be taken while using & keeping on floorREAD MORE"
468,468,Classy product,very nice product from Dr Trust . It gives accurate results every time except first time of use .READ MORE,5Classy product,dr-trust-usa-executive-rechargeable-digital-weighing-scale-electronic-weight-machine-human-body-temperature-display-usb-cable-included,5,0.48250000000000004,Positive, very nice product from Dr Trust . It gives accurate results every time except first time of use .READ MORE
469,469,Just wow!,Excellent precision. Excellent battery backup.  great looks. ideal choice to keep a check on your weight. Happy customerREAD MORE,5Just wow!,dr-trust-usa-executive-rechargeable-digital-weighing-scale-electronic-weight-machine-human-body-temperature-display-usb-cable-included,5,0.8333333333333334,Positive, Excellent precision. Excellent battery backup. great looks. ideal choice to keep a check on your weight.
470,470,Wonderful,"I purchase first time of dr. trust product, I says about the dr. trust company is very good and product is valuable for money. I use the weighing machine of dr. trust, it is mind blowing product and digital meter is so good. I m 100% satisfied. thank you dr. trustREAD MORE",5Wonderful,dr-trust-usa-executive-rechargeable-digital-weighing-scale-electronic-weight-machine-human-body-temperature-display-usb-cable-included,5,0.4766666666666666,Positive," I purchase first time of dr. trust product, I says about the dr. trust company is very good and product is valuable for money. I use the weighing machine of dr. trust, it is mind blowing product and digital meter is so good. thank you dr. trustREAD MORE"
471,471,Brilliant,"the best weighing scale in the market right now. Don't search any other weighing scale , simply go for it. Accurate results, loved it. Also , you get a great thermometer plus an inch tape. What else you need!!!!!!READ MORE",5Brilliant,dr-trust-usa-executive-rechargeable-digital-weighing-scale-electronic-weight-machine-human-body-temperature-display-usb-cable-included,5,0.44508928571428574,Positive," the best weighing scale in the market right now. Don't search any other weighing scale , simply go for it. Accurate results, loved it. Also , you get a great thermometer plus an inch tape. What else you need!!!!! !READ MORE"
472,472,Does the job,"The product aesthetically is well enough, a little delicate though. The Feet space is inadequate and weight measure from the lower limit is not accurate and does not register for weights less than 8 or 9 KG readily which should in fact work well enough as the product is advertised to weigh as less as  5 KG. Rest is good. Definitely a good product, just needs work on 2 issues.READ MORE",3Does the job,dr-trust-usa-executive-rechargeable-digital-weighing-scale-electronic-weight-machine-human-body-temperature-display-usb-cable-included,3,0.0981060606060606,Positive," The product aesthetically is well enough, a little delicate though. The Feet space is inadequate and weight measure from the lower limit is not accurate and does not register for weights less than 8 or 9 KG readily which should in fact work well enough as the product is advertised to weigh as less as  5 KG. Definitely a good product, just needs work on 2 issues.READ MORE"
473,473,Classy product,I just love it so so much. It's so sleek and looks even way better than the picture. I have been using it for sometime and all I can say is this product is worth eveb single penny😍READ MORE,5Classy product,dr-trust-usa-executive-rechargeable-digital-weighing-scale-electronic-weight-machine-human-body-temperature-display-usb-cable-included,5,0.32142857142857145,Positive, It's so sleek and looks even way better than the picture. I have been using it for sometime and all I can say is this product is worth eveb single penny😍READ MORE
474,474,Super!,I heard that this weighing machine shows different weight all the time. It's totally wrong. The machine show ACCURATE WEIGHT all the time as I tested it frequently. The usb charging facility is the best thing I like about this weighing machine.READ MORE,5Super!,dr-trust-usa-executive-rechargeable-digital-weighing-scale-electronic-weight-machine-human-body-temperature-display-usb-cable-included,5,0.25,Positive, I heard that this weighing machine shows different weight all the time. The machine show ACCURATE WEIGHT all the time as I tested it frequently. The usb charging facility is the best thing I like about this weighing machine.READ MORE
